{"$id":"urn:acme-firm:schema:qa-verdict:1.0.0","$schema":"https://json-schema.org/draft/2020-12/schema","additionalProperties":false,"description":"Dictamen interno ligado al hash exacto de PROVENANCE; no representa revisión externa.","properties":{"$schema":{"const":"../schemas/qa_verdict.schema.json","type":"string"},"approval_refs":{"items":{"minLength":1,"type":"string"},"minItems":1,"type":"array","uniqueItems":true},"findings":{"items":{"additionalProperties":false,"properties":{"claim":{"minLength":1,"type":"string"},"evidence_refs":{"items":{"minLength":1,"type":"string"},"type":"array","uniqueItems":true},"finding_id":{"minLength":1,"type":"string"},"object_ref":{"minLength":1,"type":"string"},"perspective":{"enum":["science_design_and_doctoral_methodology","affective_computing_and_appraisal","software_architecture_and_engineering","verification_testing_and_reproducibility","construct_validity_ethics_and_data_protection","open_science_metadata_intellectual_property_and_licensing"],"type":"string"},"rationale":{"minLength":1,"type":"string"},"required_action":{"type":"string"},"severity":{"enum":["blocker","major","minor","observation"],"type":"string"},"status":{"enum":["open","resolved","accepted_with_rationale","not_applicable"],"type":"string"}},"required":["finding_id","perspective","severity","status","object_ref","claim","evidence_refs","rationale","required_action"],"type":"object"},"type":"array","uniqueItems":true,"x-ifm6-unique-by":["finding_id"]},"gate_id":{"const":"QA-T03-INTERNAL-001","type":"string"},"perspective_statuses":{"items":{"additionalProperties":false,"properties":{"perspective":{"enum":["science_design_and_doctoral_methodology","affective_computing_and_appraisal","software_architecture_and_engineering","verification_testing_and_reproducibility","construct_validity_ethics_and_data_protection","open_science_metadata_intellectual_property_and_licensing"],"type":"string"},"rationale":{"minLength":1,"type":"string"},"status":{"enum":["not_run","complete","not_applicable"],"type":"string"}},"required":["perspective","status","rationale"],"type":"object"},"maxItems":6,"minItems":6,"type":"array","uniqueItems":true,"x-ifm6-unique-by":["perspective"]},"reviewed_at_utc":{"pattern":"^[0-9]{4}-(?:0[1-9]|1[0-2])-(?:0[1-9]|[12][0-9]|3[01])T(?:[01][0-9]|2[0-3]):[0-5][0-9]:[0-5][0-9](?:\\.[0-9]+)?Z$","type":"string"},"reviewed_object_path":{"const":"PROVENANCE.json","type":"string"},"reviewed_object_sha256":{"pattern":"^[0-9a-f]{64}$","type":"string"},"schema_version":{"const":"1.0.0","type":"string"},"validator_records":{"items":{"additionalProperties":false,"properties":{"execution_status":{"enum":["not_run","pass","fail"],"type":"string"},"exit_code":{"oneOf":[{"type":"null"},{"minimum":0,"type":"integer"}]},"validator_command":{"minLength":1,"type":"string"},"validator_id":{"minLength":1,"type":"string"}},"required":["validator_id","validator_command","execution_status","exit_code"],"type":"object"},"minItems":1,"type":"array","uniqueItems":true,"x-ifm6-unique-by":["validator_id"]},"verdict":{"enum":["not_run","pass","pass_with_minor","fail"],"type":"string"}},"required":["$schema","schema_version","gate_id","reviewed_object_path","reviewed_object_sha256","perspective_statuses","validator_records","findings","verdict","reviewed_at_utc","approval_refs"],"title":"IFATIGUE-INFRA6-M6 internal QA verdict contract","type":"object"}
