{"$schema":"../schemas/qa_verdict.schema.json","approval_refs":["T03-CIT-015","T03-MP-013","T03-QG-014","T03-RP-012"],"findings":[{"claim":"El validador del dictamen no fijaba suficientemente la identidad y los comandos de los dos validadores, la resolubilidad e integridad de las evidencias y la coherencia entre hallazgos, perspectivas y veredicto.","evidence_refs":["commands/validate_qa_verdict.py|sha256=346e65e9dc469008e708ecb523b6524c1b555495a203bf6c12be45744df7abf8","schemas/qa_verdict.schema.json|sha256=89c77cba4b857af216b6cd60b1da5b04bbb4e55f3aaa0adea70afe1792aeb147","PROVENANCE.json#/decisions/22/decision/verdict_contract|sha256=1818a4ee89dca14d3bf1c7583595cc3193aeb17a68420ded321692f5429ad319","PROVENANCE.json#/decisions/24/decision/validator_registry|sha256=1818a4ee89dca14d3bf1c7583595cc3193aeb17a68420ded321692f5429ad319"],"finding_id":"QAF-GATE-001","object_ref":"T03-QG-014","perspective":"verification_testing_and_reproducibility","rationale":"Se corrigió el validador para exigir exactamente los dos identificadores y comandos aprobados, resolver rutas y punteros JSON, comprobar hashes, impedir que decisiones abiertas funcionen como aprobaciones y derivar el veredicto desde estados y severidades.","required_action":"","severity":"blocker","status":"resolved"},{"claim":"La implementación del cierre no demostraba de forma completa la pertenencia exacta del ZIP al árbol de 159 archivos, el perfil reproducible aprobado y la separación de los tres productos externos.","evidence_refs":["scripts/build_release.py|sha256=a576212f355f3d18c2145e34036983c01fc8b628df15f3330015c9c12bbdc289","PROVENANCE.json#/decisions/23/decision/zip_profile|sha256=1818a4ee89dca14d3bf1c7583595cc3193aeb17a68420ded321692f5429ad319","PROVENANCE.json#/external_distribution_tree|sha256=1818a4ee89dca14d3bf1c7583595cc3193aeb17a68420ded321692f5429ad319"],"finding_id":"QAF-RELEASE-002","object_ref":"T03-RP-012","perspective":"software_architecture_and_engineering","rationale":"El finalizador ahora valida pertenencia exacta, raíz única, orden ASCII, ZIP_STORED, fecha fija, modo 0100644, ausencia de directorios, enlaces, campos extra y ZIP64, y mantiene ZIP y sidecars fuera del candidato. La materialización real sigue reservada a T03.3-10.","required_action":"","severity":"major","status":"resolved"},{"claim":"No existía una ruta finalizadora automática y transaccional que ejecutara todos los gates, derivara los dos nodos internos finales, verificara el manifiesto y revirtiera escrituras parciales ante un fallo.","evidence_refs":["scripts/build_release.py|sha256=a576212f355f3d18c2145e34036983c01fc8b628df15f3330015c9c12bbdc289","manifests/GENERATION_TOPOLOGY.json#/build_order|sha256=36d7c650f288fe151f77c767a7f042ac95b214517966ad380f72dc58b8336ca9","PACKAGE_METADATA.json#/pending_paths|sha256=df29f85fa5e7cbfc8fa7e226d738613b115d1210a7156e8c57d346658225bc46","PROVENANCE.json#/decisions/24/decision/failure_policy|sha256=1818a4ee89dca14d3bf1c7583595cc3193aeb17a68420ded321692f5429ad319"],"finding_id":"QAF-FINALIZER-003","object_ref":"T03-MP-013","perspective":"verification_testing_and_reproducibility","rationale":"Se materializó un finalizador con preflight no mutante, gates fuente y QA, derivación determinista de BUILD_RECORD y manifiesto final, verificación posterior, escritura atómica y restauración de estados previos si falla el cierre.","required_action":"","severity":"blocker","status":"resolved"},{"claim":"La licencia efectiva, la titularidad institucional, los derechos de posibles coautores o patrocinadores y los identificadores públicos siguen sin resolverse; T03-CIT-015 solo autoriza identidad mínima de citación y omisiones explícitas.","evidence_refs":["PROVENANCE.json#/open_decisions/0|sha256=1818a4ee89dca14d3bf1c7583595cc3193aeb17a68420ded321692f5429ad319","PROVENANCE.json#/decisions/25|sha256=1818a4ee89dca14d3bf1c7583595cc3193aeb17a68420ded321692f5429ad319","LICENSE_PROPOSED.md|sha256=27bcafe05a1024d92d697898d25971b3275f8a843ab4ae3d6832fbfeb9e0cb02","CITATION.cff|sha256=9fc03743be8bb20ce8e25542f0b5e24a01d5878127708acb1250b5e7423844f3"],"finding_id":"QAF-IP-004","object_ref":"T05-IP-001","perspective":"open_science_metadata_intellectual_property_and_licensing","rationale":"La observación no bloquea este candidato interno porque no se concede licencia ni se declara liberación pública. La resolución sustantiva permanece asignada a T05; no hay acción correctiva exigible dentro del gate T03.3-9.","required_action":"","severity":"observation","status":"accepted_with_rationale"},{"claim":"Un pass de este control interno podría sobreinterpretarse como panel experto externo F5, revisión por pares, reproducción limpia T04 o validación empírica, clínica o psicométrica.","evidence_refs":["PROVENANCE.json#/decisions/22/decision/prohibited_interpretations|sha256=1818a4ee89dca14d3bf1c7583595cc3193aeb17a68420ded321692f5429ad319","PACKAGE_METADATA.json#/claim_boundary|sha256=df29f85fa5e7cbfc8fa7e226d738613b115d1210a7156e8c57d346658225bc46","docs/SCOPE_AND_LIMITATIONS.md|sha256=14321ce616de687249bf8c5268de0a23c982db07867aea0b8f03bd49e876ec60","docs/DATA_ETHICS_AND_CONSTRUCT_VALIDITY.md|sha256=7ff27ac1376f29a16f68b5f561ea59946df7a7fa72073a2ec6b5fa85875d5e44"],"finding_id":"QAF-EPISTEMIC-005","object_ref":"QA-T03-INTERNAL-001","perspective":"science_design_and_doctoral_methodology","rationale":"La frontera epistémica está explícita en los contratos y documentos. La observación no exige corrección adicional en T03.3-9; F5, T04 y cualquier validación con personas o datos reales siguen siendo evaluaciones separadas.","required_action":"","severity":"observation","status":"accepted_with_rationale"},{"claim":"El mapa humano de fuentes estaba declarado como derivación automática aunque había sido redactado y reconciliado documentalmente, sin un generador registrado.","evidence_refs":["PROVENANCE.json#/planned_tree/71|sha256=1818a4ee89dca14d3bf1c7583595cc3193aeb17a68420ded321692f5429ad319","docs/SOURCE_MAP.md|sha256=29e7ca389ec113d4dfd2cee5881579455e157cd89d6c8bb72e82f77ef297e15b","sources/DERIVATION_LEDGER.csv|sha256=dbb211d7739889cd5d35a2b4768d68d2095c5c191f810e2839330e483d31d693"],"finding_id":"QAF-ORIGIN-006","object_ref":"docs/SOURCE_MAP.md","perspective":"open_science_metadata_intellectual_property_and_licensing","rationale":"Se reclasificó como generated_for_doctoral_instance y se explicitó que es una síntesis documental nueva contrastada contra los tres registros autoritativos, no una salida ejecutada.","required_action":"","severity":"major","status":"resolved"},{"claim":"El primer registro poscorrida omitía los objetos package e historical_antecedent requeridos por tres localizadores preservados del libro de derivación.","evidence_refs":["PACKAGE_METADATA.json#/package|sha256=df29f85fa5e7cbfc8fa7e226d738613b115d1210a7156e8c57d346658225bc46","PACKAGE_METADATA.json#/historical_antecedent|sha256=df29f85fa5e7cbfc8fa7e226d738613b115d1210a7156e8c57d346658225bc46","sources/DERIVATION_LEDGER.csv|sha256=dbb211d7739889cd5d35a2b4768d68d2095c5c191f810e2839330e483d31d693"],"finding_id":"QAF-METADATA-007","object_ref":"PACKAGE_METADATA.json","perspective":"verification_testing_and_reproducibility","rationale":"Se corrigió el generador, se regeneró el registro canónico y la validación estricta resolvió los 2 275 renglones sin errores ni advertencias.","required_action":"","severity":"major","status":"resolved"},{"claim":"El validador del libro interpretaba el registro inmutable de materialización T03.3-9 como un inventario vivo después de la finalización y clasificaba todo BUILD_RECORD existente como prematuro, por lo que rechazaba un candidato posfinal íntegro.","evidence_refs":["scripts/validate_derivation_ledger.py|sha256=c2ac37e121d4b6960bdf026744002966a46b2d7e8baf1fc9386d02a34cb3b666","scripts/build_release.py|sha256=a576212f355f3d18c2145e34036983c01fc8b628df15f3330015c9c12bbdc289","PACKAGE_METADATA.json#/materialization_transaction|sha256=df29f85fa5e7cbfc8fa7e226d738613b115d1210a7156e8c57d346658225bc46","PACKAGE_METADATA.json#/pending_paths|sha256=df29f85fa5e7cbfc8fa7e226d738613b115d1210a7156e8c57d346658225bc46"],"finding_id":"QAF-POSTFINAL-008","object_ref":"VAL-DERIVATION-LEDGER-001","perspective":"verification_testing_and_reproducibility","rationale":"Se corrigió el validador para tratar PACKAGE_METADATA.json como la instantánea histórica e inmutable de T03.3-9. En estado posfinal, los dos nodos internos finales solo se aceptan como una pareja completa y autenticada; se comprueban su estructura, pertenencia y fijación criptográfica, y se rechazan estados parciales o desactualizados. Esto restablece la validación posfinal y la idempotencia del finalizador.","required_action":"","severity":"blocker","status":"resolved"}],"gate_id":"QA-T03-INTERNAL-001","perspective_statuses":[{"perspective":"science_design_and_doctoral_methodology","rationale":"Se revisaron el encuadre DSR, los siete artefactos y el alcance de evidencia. La instancia solo sustenta instanciación, conformidad técnica y trazabilidad mediante evidencia sintética interna; no sustenta A5, causalidad, utilidad ni validez empírica.","status":"complete"},{"perspective":"affective_computing_and_appraisal","rationale":"Se revisaron los papeles de General Appraisal y del filtro emocional, la preservación de términos publicados, los adaptadores explícitos y la modulación exclusiva de coping_potential. El paquete no reproduce el cálculo psicológico completo ni valida el constructo de fatiga.","status":"complete"},{"perspective":"software_architecture_and_engineering","rationale":"Se revisaron estructura, contratos de entrada y salida, cuatro bindings explícitos, política fail-closed, separación de capas y finalizador determinista. Los dos nodos internos finales y la distribución permanecen deliberadamente reservados para T03.3-10.","status":"complete"},{"perspective":"verification_testing_and_reproducibility","rationale":"Se revisaron el manifiesto fuente, oráculos independientes, 16 resultados, 15 trazas,